,State/UT,Name of Medical College,City/Town,"Govt/ 
Private","Admission 
Capacity","No. of  
beds in  
Attached 
Hospital"
0,"Andaman & 
Nicobar Islands","Andaman & Nicobar Islands Insitute of Medical Sciences, 
Port Blair",Port Blair,Govt.,100,460
1,Andhra Pradesh,ACSR Government Medical College Nellore,Nellore,Govt.,150,750
2,Andhra Pradesh,"All India Institute of Medical Sciences, Mangalagiri, 
Vijaywada",Vijaywada,Govt.,50,
3,Andhra Pradesh,"Alluri Sitaram Raju Academy of Medical Sciences, Eluru",Eluru,Trust,150,1070
4,Andhra Pradesh,"Andhra Medical College, Visakhapatnam",Visakhapatnam,Govt.,200,2017
5,Andhra Pradesh,"Apollo Institute of Medical Sciences and Research, Chittoor",Chittoor,Society,150,
6,Andhra Pradesh,"Dr. P.S.I. Medical College , Chinoutpalli",Chinoutpalli,Trust,150,398
7,Andhra Pradesh,"Fathima Instt. of Medical Sciences,Kadapa",Kadapa,Trust,100,450
8,Andhra Pradesh,"Gayathri Vidya Parishad Institute of Health Care & Medical  
Technology, Visakhapatnam.",Visakhapatnam,Society,150,
9,Andhra Pradesh,"GITAM Institute of Medical Sciences and Research, 
Visakhapatam",Visakhapatanam,University,0,
10,Andhra Pradesh,"Government Medical College, Anantapuram",Anantapurram,Govt.,100,500
11,Andhra Pradesh,"Government Siddhartha Medical College, Vijaywada",Vijaywada,Govt.,150,412
12,Andhra Pradesh,"Great Eastern Medical School and Hospital,Srikakulam",Srikakulam,Trust,100,350
13,Andhra Pradesh,"GSL Medical College, Rajahmundry",Rajahmundry,Trust,150,1000
14,Andhra Pradesh,"Guntur Medical College, Guntur",Guntur,Govt.,200,1277
15,Andhra Pradesh,"Katuri Medical College, Guntur",Guntur,Trust,150,900
16,Andhra Pradesh,"Konaseema Institute of Medical Sciences & Research 
Foundation, Amalapuram",Amalapuram,Trust,150,879
17,Andhra Pradesh,"Kurnool Medical College, Kurnool",Kurnool,Govt.,200,1050
18,Andhra Pradesh,"Maharajah Institute of Medical Sciences, Vizianagaram",Vizianagaram,Trust,150,1050
19,Andhra Pradesh,"Narayana Medical College, Nellore",Nellore,Trust,250,1550
20,Andhra Pradesh,"Nimra Institute of Medical Sciences, Krishna Dist.",Krishna Dist.,Society,150,
21,Andhra Pradesh,"NRI Institute of Medical Sciences, Visakhapatnam",Visakhapatnam,Trust,150,360
22,Andhra Pradesh,"NRI Medical College, Guntur",Guntur,Trust,200,1000
23,Andhra Pradesh,"P E S Institute Of Medical Sciences and Research, Kuppam",Kuppam,Trust,150,750
24,Andhra Pradesh,"Rajiv Gandhi Institute of Medical Sciences, Kadapa",Kadapa,Govt.,150,750
25,Andhra Pradesh,"Rajiv Gandhi Institute of Medical Sciences, Srikakulam",Srikakulam,Govt.,100,300
26,Andhra Pradesh,"Rajiv Gandhi Institute of Medical Sciences,Ongole, AP",Ongole,Govt.,100,300
27,Andhra Pradesh,"Rangaraya Medical College, Kakinada",Kakinada,Govt.,200,1085
28,Andhra Pradesh,"S V Medical College, Tirupati",Tirupati,Govt.,200,862
29,Andhra Pradesh,"Santhiram Medical College, Nandyal",Nandyal,Trust,100,700
30,Andhra Pradesh,"SVIM-Sri Padmavathi Medical College for Women, Alipiri 
Road, Tirupati",Tirupati,Govt.,150,650
31,Andhra Pradesh,"Viswabharathi Medical College, Kurnool",Kurnool,Society,0,
32,"Arunachal 
Pradesh","Toma Riba Institute of health & Medical Sciences, 
Naharlagun",Naharlagun,Govt.,50,
33,Assam,"Assam Medical College, Dibrugarh",Dibrugarh,Govt.,170,1365
34,Assam,"Fakhruddin Ali Ahmed Medical College, Barpeta, Assam","Barpeta,",Govt-Society,100,500
35,Assam,"Gauhati Medical College, Guwahati",Guwahati,Govt.,156,1982
36,Assam,"Jorhat Medical College & Hospital , Jorhat",Jorhat,Govt.,100,400
37,Assam,"Silchar Medical College, Silchar",Silchar,Govt.,100,906
38,Assam,"Tezpur Medical College & Hospital, Tezpur",Tezpur,Govt.,100,500
39,Bihar,"All India Institute of Medical Sciences  Patna, Bihar",Patna,Govt,100,
40,Bihar,"Anugrah Narayan Magadh Medical College, Gaya",Gaya,Govt.,100,544
41,Bihar,"Darbhanga Medical College, Lehriasarai",Lehriasarai,Govt.,100,1030
42,Bihar,"Government Medical College, Bettiah",Bettiah,Govt.,100,315
43,Bihar,"Indira Gandhi Institute of Medical Sciences,Sheikhpura Patna",Patna,Govt.,100,500
44,Bihar,"Jawaharlal Nehru Medical College, Bhagalpur",Bhagalpur,Govt.,100,659
45,Bihar,"Katihar Medical College, Katihar",Katihar,Trust,100,580
46,Bihar,Lord Buddha Koshi Medical College and Hospital,Saharsa,Trust,,
47,Bihar,Madhubani Medical College,Madhubani,Trust,,
48,Bihar,"Mata Gujri Memorial Medical College, Kishanganj",Kishanganj,Trust,100,
49,Bihar,"Nalanda Medical College, Patna",Patna,Govt.,100,752
50,Bihar,"Narayan Medical College & Hospital, Sasaram",Sasaram,Trust,150,500
51,Bihar,"Patna Medical College, Patna",Patna,Govt.,150,1675
52,Bihar,"Shri Krishna Medical College, Muzzafarpur",Muzzafarpur,Govt.,100,612
53,Bihar,"Vardhman Institute of Medical Sciences, Pawapuri, Nalanda",Nalanda,Govt.,100,
54,Chandigarh,"Government Medical College, Chandigarh",Chandigarh,Govt.,100,
55,Chhattisgarh,All India Institute of Medical Sciences  Raipur,Raipur,Govt,100,
56,Chhattisgarh,"Chandulal Chandrakar Memorial Medical College, Durg",Durg,Private,0,750
57,Chhattisgarh,"Chhattisgarh Institute of Medical Sciences, Bilaspur",Bilaspur,Govt.,100,672
58,Chhattisgarh,"Govt. Medical College, Ambikapur(Surguja)",Ambikapur,Govt.,100,414
59,Chhattisgarh,"Government Medical College, Rajnandgaon",Rajnandgaon,Govt.,100,380
60,Chhattisgarh,"Late Shri Baliram Kashyap Memorial NDMC Govt. Medical 
College, Jagdalpur",Jagdalpur,Govt.,100,470
61,Chhattisgarh,"Late Shri Lakhi Ram Agrawal Memorial Govt. Medical 
College, Raigarh",Raigarh,Govt.,50,650
62,Chhattisgarh,"Pt. J N M Medical College, Raipur",Raipur,Govt.,150,1153
63,Chhattisgarh,"Raipur Institute of Medical Sciences(RIMS), Raipur.",Raipur,Society,0,300
64,Chhattisgarh,"Shri Shankaracharya Institute of Medical Sciences, Bhilai",Bhilai,Society,0,350
65,"Dadra nad Nagar 
Haveli","Shri Vinoba Bhave Institute of Medical Sciences, (Govt. 
Medical College)",Silvassa,Govt.,,
66,Delhi,"All India Institute of Medical Sciences, New Delhi",New Delhi,Govt.,50,2362
67,Delhi,"Army College of Medical Sciences, New Delhi",New Delhi,Trust,100,999
68,Delhi,"Dr. Baba Saheb Ambedkar Medical College, Rohini, Delhi",Delhi,Govt.,100,
69,Delhi,"Hamdard Institute of Medical Sciences & Research, New 
Delhi",New Delhi,Society,100,350
70,Delhi,"Lady Hardinge Medical College, New Delhi",New Delhi,Govt.,200,877
71,Delhi,"Maulana Azad Medical College, New Delhi",New Delhi,Govt.,250,1500
72,Delhi,"North Delhi Muncipal Corporation Medical College, Delhi",New Delhi,Govt.,50,980
73,Delhi,"University College of Medical Sciences & GTB Hospital, New 
Delhi",New Delhi,Govt.,150,872
74,Delhi,Vardhman Mahabir Medical College & Safdarjung Hospital.,New Delhi,Govt.,150,1531
75,Goa,"Goa Medical College, Panaji",Panaji,Govt.,150,1160
76,Gujarat,"Ahmedabad Municipal Coporation Medical Education Trust 
Medical College, Ahmedabad",Ahmedabad,Govt.,150,645
77,Gujarat,"B J Medical College, Ahmedabad",Ahmedabad,Govt.,250,2000
78,Gujarat,"Banas Medical College and Research Institute, Palanpur",Palanpur,Trust,150,
79,Gujarat,"CU Shah Medical College, Surendra Nagar",Surendra Nagar,Trust,100,570
80,Gujarat,"Dr M.K. Saha Medical College and Research Centre, 
Ahmedabad",Ahmedabad,Trust,0,1120
81,Gujarat,"Dr.N.D. Desai Faculty of Medical Science and Research, 
Nadiad",Nadiad,University,150,
82,Gujarat,"GCS Medical College, Ahmedabad",Ahmedabad,Trust,150,425
83,Gujarat,"GMERS Medical College, Dharpur Patan",Dharpur Patan,Govt-Society,150,650
84,Gujarat,"GMERS Medical College, Gandhinagar",Gandhinagar,Govt-Society,150,650
85,Gujarat,"GMERS Medical College, Gotri, Vadodara",Vadodara,Govt-Society,150,650
86,Gujarat,"GMERS Medical College,Hadiyol, Himmatnagar",Himmatnagar,Govt-Society,150,410
87,Gujarat,"GMERS Medical College, Junagadh",Junagadh,Govt-Society,150,510
88,Gujarat,"GMERS Medical College, Sola, Ahmedabad",Ahmedabad,Govt-Society,150,720
89,Gujarat,"GMERS Medical CollegeVadnagar, Mehsana",Mehsana,Govt-Society,150,300
90,Gujarat,"GMERS Medical College, Valsad",Valsad,Govt-Society,150,650
91,Gujarat,"Government Medical College, Bhavnagar",Bhavnagar,Govt.,150,1035
92,Gujarat,"Government Medical College, Surat",Surat,Govt.,250,1050
93,Gujarat,"Gujarat Adani Institute of Medical Sciences, Bhuj, Kachcha",Kachcha,Trust,150,645
94,Gujarat,"Medical College, Baroda",Baroda,Govt.,250,1513
95,Gujarat,"MP Shah Medical College,Jamnagar",Jamnagar,Govt.,250,1290
96,Gujarat,"Nootan Medical College and Research Centre, Mehsana",Mehsana,Trust,150,
97,Gujarat,"Pandit Deendayal Upadhyay Medical College, Rajkot",Rajkot,Govt.,150,850
98,Gujarat,"Parul Institute of Medical Sciences & Research, Vadodara",Vadodara,Private,150,
99,Gujarat,"Pramukhswami Medical College, Karmsad, Anand",Anand,Trust,100,550
100,Gujarat,"SBKS Medical Instt. & Research Centre, Vadodra",Vadodra,Trust,150,1120
101,Gujarat,Shantabaa Medical College,Amreli,Trust,,
102,Gujarat,"Smt. N.H.L.Municipal Medical College, Ahmedabad",Ahmedabad,Govt.,250,1600
103,Gujarat,"Surat Municipal Institute of Medical Education & Research, 
Surat",Surat,Govt.,150,750
104,Gujarat,"Zydus Medical College & Hospital, Dahod",Dahod,Trust,150,
105,Haryana,"Adesh Medical College and Hospital, Sahabad, Kurushetra",Sahabad,society,0,
106,Haryana,"Aal Falah School of Medical Sciences & Research Centre, 
Faridabad",Faridabad,Private,150,
107,Haryana,"BPS Government Medical College for Women, Sonepat",Sonepat,Govt.,100,500
108,Haryana,"Employees State Insurance Corporation Medical College, 
Faridabad",Faridabad,Govt.,100,
109,Haryana,"Faculty of Medicine and Health Sciences, Gurgaon",Gurgaon,Trust,150,
110,Haryana,"Kalpana Chawala Govt. Medical College, Karnal",Karnal,Govt.,100,
111,Haryana,"Maharaja Agrasen Medical College, Agroha",Agroha,Trust,100,450
112,Haryana,"Maharishi Markandeshwar Institute Of Medical Sciences & 
Research, Mullana, Ambala",Ambala,Trust,150,1063
113,Haryana,"N.C. Medical College & Hospital, Panipath",Panipath,Trust,0,
114,Haryana,"Pt. B D Sharma Postgraduate Institute of Medical Sciences, 
Rohtak (Haryana)",Rohtak,Govt.,200,1710
115,Haryana,"Shaheed Hasan Khan Mewati Government Medical College, 
Nalhar",Nalhar,Govt.,100,500
116,Haryana,"World College of Medical Sciences & Research, Jhajjar",Jhajjar,Trust,0,
117,"Himachal 
Pradesh","Dr. Radhakrishnan Govt. Medical College, Hamirpur",Hamirpur,Govt.,100,
118,"Himachal 
Pradesh","Dr. Rajendar Prasad Government Medical College, Tanda, H.P","Tanda,",Govt.,100,593
119,"Himachal 
Pradesh","Government Medical College, Nahan, Sirmour",Sirmour,Govt.,100,300
120,"Himachal 
Pradesh","Indira Gandhi Medical College, Shimla",Shimla,Govt.,100,835
121,"Himachal 
Pradesh","Maharishi Markandeshwar Medical College & Hospital, Solan",Solan,Trust,150,300
122,"Himachal 
Pradesh","Pt.Jawahar Lal Nehru Govt. Medicalcollege, Chamba",Chamba,Govt.,100,
123,"Himachal 
Pradesh","Shri Lal Bahadur Shastri Govt. Medical College, Mandi",Mandi,Govt.,100,
124,"Jammu & 
Kashmir","Acharya Shri Chander College of Medical Sciences, Jammu",Jammu,Trust,100,500
125,"Jammu & 
Kashmir",Government Medical College,Anantnag,Govt.,,
126,"Jammu & 
Kashmir",Government Medical College & Associated Hospital,Rajouri,Govt.,,
127,"Jammu & 
Kashmir",Government Medical College,Baramulla,Govt.,,
128,"Jammu & 
Kashmir",Government Medical College,Jammu,Govt.,150,2295
129,"Jammu & 
Kashmir",Government Medical College,Kathua,Govt.,,
130,"Jammu & 
Kashmir","Government Medical College, Srinagar",Srinagar,Govt.,150,2550
131,"Jammu & 
Kashmir","Sher-I-Kashmir Instt. Of Medical Sciences, Srinagar",Srinagar,Govt.,100,250
132,Jharkhand,"M G M Medical College, Jamshedpur",Jamshedpur,Govt.,100,514
133,Jharkhand,"Patliputra Medical College, Dhanbad",Dhanbad,Govt.,50,500
134,Jharkhand,"Rajendra Institute of Medical Sciences, Ranchi",Ranchi,Govt.,150,1500
135,Karnataka,"A J Institute of Medical Sciences & Research Centre, 
Mangalore",Mangalore,Trust,150,900
136,Karnataka,Adichunchanagiri Institute of Medical Sciences Bellur,Bellur,Trust,150,750
137,Karnataka,"Akash Institute of Medical Sciences & Research Centre, 
Banglore",Banglore,Trust,0,
138,Karnataka,"Al-Ameen Medical College,Bijapur",Bijapur,Trust,100,760
139,Karnataka,"Bangalore Medical College and Research Institute, Bangalore",Bangalore,Govt.,250,1475
140,Karnataka,"Basaveswara Medical College and Hospital, Chitradurga",Chitradurga,Trust,100,628
141,Karnataka,"Belagavi Institute of Medical Sciences, Belgaum",Belagavi,Govt.,150,740
142,Karnataka,"BGS Global Institute of Medical Sciences, Bangalore",Bangalore,Trust,150,300
143,Karnataka,"Bidar Institute of Medical Sciences,Bidar",Bidar,Govt.,150,500
144,Karnataka,Bowring & Lady Curzon Medical College & Research Institute,Banglore,Govt.,,
145,Karnataka,"Chamrajanagar Institute of Medical Sciences,",Chamrajanagar,Govt.,150,
146,Karnataka,"Dr BR Ambedkar Medical College, Bangalore",Bangalore,Trust,100,600
147,Karnataka,"East Point College of Medical Sciences & Research Centre, 
Banglore",Banglore,Trust,150,
148,Karnataka,"Employees State Insurance Corporation Medical College, 
Bangalore",Bangalore,Govt.,100,500
149,Karnataka,"Employees State Insurance Corporation Medical College, 
Gulbarga",Gulbarga,Govt.,100,
150,Karnataka,"Father Mullers Institue of Medical Education and Research, 
Mangalore",Mangalore,Trust,150,1250
151,Karnataka,"Gadag Institute of Medical Sciences, Mallasamudra, Mulgund 
Road, Gadag",Gadag,Govt.,150,
152,Karnataka,"Government Medical College, Mysore",Mysore,Govt.,150,1940
153,Karnataka,"Gulbarga Institute of Medical Sciences, Gulbarga",Gulbarga,Govt.,150,
154,Karnataka,"Hassan Institute of Medical Sciences, Hassan",Hassan,Govt.,150,500
155,Karnataka,"Jawaharlal Nehru Medical College, Belgaum",Belgaum,Trust,200,2200
156,Karnataka,"JJM Medical College, Davangere",Davangere,Trust,245,2069
157,Karnataka,"JSS Medical College, Mysore",Mysore,Trust,200,1050
158,Karnataka,"K S Hegde Medical Academy, Mangalore",Mangalore,Trust,150,1200
159,Karnataka,"K V G Medical College, Sullia",Sullia,Trust,100,570
160,Karnataka,"Kanachur Institute of Medical Sciences, Manglore",Mangalore,Trust,150,
161,Karnataka,"Karnataka Institute of Medical Sciences, Hubli",Hubli,Govt.,200,1200
162,Karnataka,"Karwar Institute of Medical Sciences, Karwar",Karwar,Govt.,150,
163,Karnataka,"Kasturba Medical College, Mangalore",Mangalore,Trust,250,1280
164,Karnataka,"Kasturba Medical College, Manipal",Manipal,Trust,250,2032
165,Karnataka,"Kempegowda Institute of Medical Sciences, Bangalore",Bangalore,Trust,150,1100
166,Karnataka,"Khaja Banda Nawaz University -Faculty of Medical Sciences, 
Gulbarga",Gulbarga,Trust,100,540
167,Karnataka,"Kodagu Institute of Medical Sciences, Kodagu",Kodagu,Govt.,150,
168,Karnataka,"Koppal Institute of Medical Sciences, Koppal",Koppal,Govt.,150,
169,Karnataka,"M S Ramaiah Medical College, Bangalore",Bangalore,Trust,150,1331
170,Karnataka,"Mahadevappa Rampure Medical College, Gulbarga",Gulbarga,Trust,150,1073
171,Karnataka,"Mandya Institute of Medical Sciences, Mandya",Mandya,Govt.,150,580
172,Karnataka,"MVJ Medical College and Research Hospital, Bangalore",Bangalore,Trust,150,900
173,Karnataka,"Navodaya Medical College, Raichur",Raichur,Trust,150,860
174,Karnataka,"Raichur Institute of Medical Sciences,Raichur",Raichur,Govt.,150,550
175,Karnataka,"Rajarajeswari Medical College & Hospital, Bangalore",Bangalore,Trust,250,1110
176,Karnataka,"S S Institute of Medical Sciences& Research Centre, 
Davangere",Davangere,Trust,150,930
177,Karnataka,"S. Nijalingappa Medical College & HSK Hospital & Research 
Centre, Bagalkot",Bagalkot,Trust,150,820
178,Karnataka,"Sambhram Institute of Medical Sciences & Research, Kolar",Kolar,Trust,0,
179,Karnataka,"Sapthagiri Institute of Medical Sciences & Research Centre, 
Bangalore",Bangalore,Trust,150,640
180,Karnataka,"SDM Medical Siences & HospitalCollege , Sattur, Dharwad",Dharwad,Trust,100,700
181,Karnataka,"Shimoga Institute of Medical Sciences,Shimoga",Shimoga,Govt.,150,650
182,Karnataka,"Shri B M Patil Medical College, Hospital & Research Centre, 
Bijapur",Bijapur,Trust,150,797
183,Karnataka,"Shridevi Institute of Medical Sciences & Research Hospital, 
Tumkur",Tumkur,Trust,150,300
184,Karnataka,"S. Nijalingappa Medical College & HSK Hospital & Research 
Centre",Bagalkot,Trust,150,
185,Karnataka,"Sri Devaraj URS Medical College, Kolar",Kolar,Trust,150,1139
186,Karnataka,"Sri Siddhartha Medical College, Tumkur",Tumkur,Trust,150,1100
187,Karnataka,"Srinivas Institute of Medical Research Centre, Srinivasnagar",Srinivasnagar,Trust,150,501
188,Karnataka,"St. Johns Medical College, Bangalore",Bangalore,Trust,150,1200
189,Karnataka,"Subbaiah Institute of Medical Sciences, Shimoga, Karnataka","Shimoga,",Trust,150,345
190,Karnataka,"The Oxford Medical College, Hospital & Research Centre, 
Bangalore",Bangalore,Society,150,
191,Karnataka,"Vijaynagar Institute of Medical Sciences, Bellary",Bellary,Govt.,150,1017
192,Karnataka,"Vydehi Institute Of Medical Sciences & Research Centre, 
Bangalore",Bangalore,Trust,150,1100
193,Karnataka,"Yenepoya Medical College, Mangalore",Mangalore,Trust,150,929
194,Kerala,"Academy of Medical Sciences,Pariyaram, Kannur",Kannur,Trust,100,1200
195,Kerala,"Al-Azhar Medical College and Super Speciality Hospital, 
Thodupuzha",Thodupuzha,Trust,0,380
196,Kerala,"Amala Institute of Medical Sciences, Thrissur",Thrissur,Trust,100,570
197,Kerala,"Amrita School of Medicine, Elamkara, Kochi",Kochi,Trust,100,1250
198,Kerala,"Azeezia Instt of Medical Science,Meeyannoor,Kollam",Kollam,Trust,100,500
199,Kerala,"Belivers Church Medical College Hospital, Thiruvalla",Thiruvalla,Trust,100,
200,Kerala,"DM Wayanad Institute of Medical Sciences, Wayanad, Kerala",Wayanad,Trust,150,
201,Kerala,"Dr. Somervel Memorial CSI Hospital & Medical College, 
Karakonam, Thiruvananthapuram",Thiruvananthapuram,Trust,100,550
202,Kerala,"Government Medical College, Ernakulam",Ernakulam,Govt,100,
203,Kerala,"Government Medical College, Kottayam",Kottayam,Govt.,150,910
204,Kerala,"Government Medical College, Kozhikode, Calicut",Calicut,Govt.,250,3080
205,Kerala,"Government Medical College, Manjeri, Malapuram Dist.",Malapuram,Govt.,100,501
206,Kerala,"Government Medical College, Painav, Idukki",Idukki,Govt.,0,300
207,Kerala,"Government Medical College, Parippally, Kollam",Kollam,Govt.,100,
208,Kerala,"Government Medical College, Thrissur",Thrissur,Govt.,150,2350
209,Kerala,"Govt Medical College, Yakkara, Palakkad",Palakkad,Govt.,100,750
210,Kerala,"Jubilee Mission Medical College & Research Institute, 
Thrissur",Thrissur,Trust,100,1620
211,Kerala,"Kannur Medical College, Kannur",Kannur,Trust,150,750
212,Kerala,"Karuna Medical College, Palakkad",Palakkad,Trust,100,500
213,Kerala,"Kerala Medical College, Mangode, Palakkad",Palakkad,Trust,0,
214,Kerala,"KMCT Medical College,Kozhikode, Calicut",Calicut,Trust,150,500
215,Kerala,"M E S Medical College , Perintalmanna Malappuram Distt.
Kerala",Malappuram,Trust,100,630
216,Kerala,"Malabar Medical College, Kozhikode,Calicut",Calicut,Trust,150,415
217,Kerala,"Malankara Orthodox Syrian Church Medical College, 
Kolenchery",Kolenchery,Trust,100,1200
218,Kerala,"Medical College, Thiruvananthapuram",Thiruvananthapuram,Govt.,200,
219,Kerala,"Mount Zion Medical College, Chayalode, Ezhamkulam Adoor, 
Pathanamthitta",Pathanamthitta,Society,0,
220,Kerala,"P K Das Institute of Medical Sciences, Palakkad, Kerala","Palakkad,",Trust,0,
221,Kerala,"Pushpagiri Institute Of Medical Sciences and Research 
Centre, Tiruvalla",Tiruvalla,Trust,100,1200
222,Kerala,"S.R. Medical College & Research Centre, Akathumjuri, 
Vennicode, Varkala, Thiruvananthapuram",Thiruvananthapuram,Trust,0,
223,Kerala,"Sree Narayana Instt. of Medical Sciences, 
Chalakka,Ernakulam",Ernakulam,Trust,100,500
224,Kerala,"Sree Uthradom Thiurnal Academy of Medical 
Sciences,Trivandrum",Trivandrum,Trust,100,500
225,Kerala,"Sri Gokulam Medical College Trust & Research Foundation, 
Trivandrum",Trivandrum,Trust,150,600
226,Kerala,"T D Medical College, Alleppey (Allappuzha)",Alleppey,Govt.,150,1051
227,Kerala,"Travancore Medical College, Kollam",Kollam,Trust,100,500
228,Madhya Pradesh,"All India Institute of Medical Sciences, Bhopal",Bhopal,Govt.,100,
229,Madhya Pradesh,"Amaltas Institute of Medical Sciences, Dewas",Dewas,Society,150,300
230,Madhya Pradesh,"Bundelkhand Medical College, Sagar",Sagar,Govt.,100,750
231,Madhya Pradesh,"Chirayu Medical College and Hospital, Bairagarh,Bhopal",Bhopal,Trust,150,1000
232,Madhya Pradesh,"Gajra Raja Medical College, Gwalior",Gwalior,Govt.,150,1320
233,Madhya Pradesh,"Gandhi Medical College, Bhopal",Bhopal,Govt.,150,935
234,Madhya Pradesh,Government Medical College,Chhindwara,Govt.,,
235,Madhya Pradesh,Government Medical College,Datia,Govt.,100,
236,Madhya Pradesh,Government Medical College,Khandwa,Govt.,100,
237,Madhya Pradesh,Government Medical College,Ratlam,Govt,150,
238,Madhya Pradesh,Government Medical College,Sahadol,Govt.,,
239,Madhya Pradesh,Government Medical College,Shivpuri,Govt.,,
240,Madhya Pradesh,Government Medical College,Vidisha,Govt.,150,
241,Madhya Pradesh,"Index Medical College Hospital & Research Centre,Indore",Indore,Trust,150,1100
242,Madhya Pradesh,"L.N. Medical College and Research Centre,Bhopal",Bhopal,Trust,150,750
243,Madhya Pradesh,"M G M Medical College, Indore",Indore,Govt.,150,980
244,Madhya Pradesh,"Netaji Subhash Chandra Bose Medical College, Jabalpur",Jabalpur,Govt.,150,840
245,Madhya Pradesh,"Peoples College of Medical Sciences & Research Centre, 
Bhanpur, Bhopal",Bhopal,Trust,150,650
246,Madhya Pradesh,"RKDF Medical College Hospital & Research Centre, Jatkhedi, 
Bhopal",Bhopal,Society,0,320
247,Madhya Pradesh,"Ruxmaniben Deepchand Gardi Medical College, Ujjain",Ujjain,Trust,150,585
248,Madhya Pradesh,"Shyam Shah Medical College, Rewa",Rewa,Govt.,100,800
249,Madhya Pradesh,"Sri Aurobindo Medical College and Post Graduate Institute , 
Indore",Indore,Trust,150,1140
250,Madhya Pradesh,"Sukh Sagar Medical College and Hospital, Jabalpur",Jabalpur,Trust,0,300
251,Maharashtra,"ACPM Medical College, Dhule",Dhule,Trust,0,
252,Maharashtra,"All India Institute of Medical Sciences, Nagpur",Nagpur,Govt.,50,
253,Maharashtra,"Armed Forces Medical College, Pune",Pune,Govt.,150,
254,Maharashtra,"Ashwini Rural Medical College, Hospital & Research Centre, 
Solapur",Solapur,Trust,100,
255,Maharashtra,"B. J. Govt. Medical College, Pune",Pune,Govt.,200,
256,Maharashtra,"B.K.L Walawalkar Rural Medical College, Ratnagiri",Ratnagiri,Trust,100,
257,Maharashtra,"Bharati Vidyapeeth Deemed University Medical College & 
Hospital, Sangli",Sangli,Trust,150,
258,Maharashtra,"Bharati Vidyapeeth University Medical College, Pune",Pune,Trust,150,
259,Maharashtra,"Dr Vaishampayan Memorial Medical College, Solapur",Solapur,Govt.,150,
260,Maharashtra,"Dr. D. Y. Patil Medical college, Hospital and Research Centre, 
Pimpri, Pune",Pune,Trust,250,
261,Maharashtra,"Dr. D Y Patil Medical College, Kolhapur",Kolhapur,Trust,150,
262,Maharashtra,"Dr. Panjabrao Alias Bhausaheb Deshmukh Memorial Medical 
College, Amravati",Amravati,Trust,100,
263,Maharashtra,"Dr. Shankarrao Chavan Govt. Medical College, Nanded",Nanded,Govt.,100,
264,Maharashtra,"Dr. Ulhas Patil Medical College & Hospital, Jalgaon",Jalgaon,Trust,100,
265,Maharashtra,"Dr.Vasantrao Pawar Med. Col. Hosp. & Research Centre, 
Nasik (Prev. NDMVP Samaj Medical College)",Nasik,Trust,120,
266,Maharashtra,Government Medical College,Latur,Govt.,150,
267,Maharashtra,Government Medical College,Akola,Govt.,150,
268,Maharashtra,Government Medical College,Aurangabad,Govt.,150,
269,Maharashtra,Government Medical College,Jalgaon,Govt.,100,
270,Maharashtra,Government Medical College,Chandrapur,Govt.,100,
271,Maharashtra,Government Medical College,Gondia,Govt.,100,
272,Maharashtra,Government Medical College,Baramati,Govt.,,
273,Maharashtra,Government Medical College,Miraj,Govt.,150,
274,Maharashtra,Government Medical College,Nagpur,Govt.,200,
275,Maharashtra,"Grant Medical College, Mumbai",Mumbai,Govt.,200,
276,Maharashtra,"H.B.T. Medical College and Dr. R.N. Cooper Municipal 
General Hospital, Juhu, Mumbai",Mumbai,Govt.,150,
277,Maharashtra,"Indian Institute of Medical Science & Research, Jalna",Jalna,Trust,100,
278,Maharashtra,"Indira Gandhi Medical College & Hospital, Nagpur",Nagpur,Govt.,150,
279,Maharashtra,"Jawaharlal Nehru Medical College, Sawangi (Meghe), Wardha Wardha",,Trust,250,
280,Maharashtra,"KJ Somaiyya Medical College & Research Centre, Mumbai",Mumbai,Trust,50,
281,Maharashtra,"Krishna Institute of Medical Sciences, Karad",Karad,Trust,150,
282,Maharashtra,"Lokmanya Tilak Municipal Medical College, Sion, Mumbai",Mumbai,Govt.,150,
283,Maharashtra,"Maharashtra Institute of Medical Sciences & Research, Latur",Latur,Trust,150,
284,Maharashtra,"Maharashtra Institute of Medical Education & Research, 
Talegaon, Pune",Pune,Trust,150,
285,Maharashtra,"Mahatma Gandhi Institute of Medical Sciences, Sevagram, 
Wardha",Wardha,Trust,100,
286,Maharashtra,"Mahatma Gandhi Missions Medical College, Aurangabad",Aurangabad,Trust,150,
287,Maharashtra,"Mahatma Gandhi Missions Medical College, Navi Mumbai",Mumbai,Trust,150,
288,Maharashtra,"N. K. P. Salve Instt. of Medical Sciences and Research Centre 
and Lata Mangeshkar Hospital, Nagpur",Nagpur,Trust,150,
289,Maharashtra,"Padmashree Dr. D.Y.Patil Medical College, Navi Mumbai",Navi Mumbai,Trust,150,
290,Maharashtra,"Padmashri Dr. Vithalrao Vikhe Patil Foundations Medical 
College, Ahmednagar",Ahmednagar,Trust,150,
291,Maharashtra,"Prakash Institute of Medicval Sciences & Research, Sangli 
Road, Uran Islampur, Maharastra",Uran Islampur,Trust,150,Na
292,Maharashtra,"Rajashree Chatrapati Shahu Maharaj Government Medical 
College, Kolhapur",Kolhapur,Govt.,150,
293,Maharashtra,"Rajiv Gandhi Medical College and Chhatrapati Shivaji 
Maharaj Hospital, Thane",Thane,Govt.,60,
294,Maharashtra,"Rural Medical College, Loni",Loni,Trust,200,
295,Maharashtra,"Seth GS Medical College, Mumbai",Mumbai,Govt.,180,
296,Maharashtra,"Shri Vasant Rao Naik Govt. Medical College, Yavatmal",Yavatmal,Govt.,150,
